{
  "schema_version": "raw-facts.v1",
  "url": "http://localhost/fixtures/basic.html",
  "viewport": {
    "width": 1440,
    "height": 900,
    "device_scale_factor": 1
  },
  "color_scheme": "light",
  "captured_at": "2026-01-01T00:00:00.000Z",
  "runtime": "bun",
  "browser": {
    "name": "chromium",
    "version": "fixture",
    "user_agent_hash": "sha256:fixture"
  },
  "pages": [
    {
      "url": "http://localhost/fixtures/basic.html",
      "title": "style-scraper fixture",
      "dom": {
        "nodes": [
          {
            "id": "node_1",
            "parent_id": null,
            "tag": "body",
            "attributes": {},
            "text_hash": "sha256:body",
            "text_length": 43,
            "visible": true,
            "child_index": 0
          },
          {
            "id": "node_2",
            "parent_id": "node_1",
            "tag": "header",
            "attributes": {},
            "text_hash": "sha256:header",
            "text_length": 10,
            "visible": true,
            "child_index": 1
          },
          {
            "id": "node_3",
            "parent_id": "node_2",
            "tag": "a",
            "attributes": {},
            "text_hash": "sha256:home",
            "text_length": 4,
            "visible": true,
            "child_index": 2
          },
          {
            "id": "node_4",
            "parent_id": "node_2",
            "tag": "button",
            "attributes": {},
            "text_hash": "sha256:start",
            "text_length": 5,
            "visible": true,
            "child_index": 3
          },
          {
            "id": "node_5",
            "parent_id": "node_1",
            "tag": "main",
            "attributes": {},
            "text_hash": "sha256:main",
            "text_length": 30,
            "visible": true,
            "child_index": 4
          },
          {
            "id": "node_6",
            "parent_id": "node_5",
            "tag": "h1",
            "attributes": {},
            "text_hash": "sha256:h1",
            "text_length": 7,
            "visible": true,
            "child_index": 5
          }
        ]
      },
      "cssom": {
        "computed_styles": [
          {
            "id": "style:node_1",
            "node_id": "node_1",
            "display": "block",
            "position": "static",
            "color": "rgb(17, 24, 39)",
            "background_color": "rgb(255, 255, 255)",
            "font_family": "Inter, system-ui, sans-serif",
            "font_size": "16px",
            "font_weight": "400",
            "line_height": "normal",
            "letter_spacing": "normal",
            "padding": "0px",
            "margin": "0px",
            "border_radius": "0px",
            "border_width": "0px",
            "border_color": "rgb(17, 24, 39)",
            "box_shadow": "none",
            "opacity": "1",
            "z_index": "auto"
          },
          {
            "id": "style:node_2",
            "node_id": "node_2",
            "display": "flex",
            "position": "static",
            "color": "rgb(17, 24, 39)",
            "background_color": "rgba(0, 0, 0, 0)",
            "font_family": "Inter, system-ui, sans-serif",
            "font_size": "16px",
            "font_weight": "400",
            "line_height": "normal",
            "letter_spacing": "normal",
            "padding": "16px 24px",
            "margin": "0px",
            "gap": "16px",
            "border_radius": "0px",
            "border_width": "0px 0px 1px",
            "border_color": "rgb(229, 231, 235)",
            "box_shadow": "none",
            "opacity": "1",
            "z_index": "auto"
          },
          {
            "id": "style:node_3",
            "node_id": "node_3",
            "display": "inline",
            "position": "static",
            "color": "rgb(37, 99, 235)",
            "background_color": "rgba(0, 0, 0, 0)",
            "font_family": "Inter, system-ui, sans-serif",
            "font_size": "16px",
            "font_weight": "400",
            "line_height": "normal",
            "letter_spacing": "normal",
            "padding": "0px",
            "margin": "0px",
            "border_radius": "0px",
            "border_width": "0px",
            "border_color": "rgb(37, 99, 235)",
            "box_shadow": "none",
            "opacity": "1",
            "z_index": "auto"
          },
          {
            "id": "style:node_4",
            "node_id": "node_4",
            "display": "flow-root",
            "position": "static",
            "color": "rgb(255, 255, 255)",
            "background_color": "rgb(37, 99, 235)",
            "font_family": "Inter, system-ui, sans-serif",
            "font_size": "16px",
            "font_weight": "600",
            "line_height": "normal",
            "letter_spacing": "normal",
            "padding": "8px 16px",
            "margin": "0px",
            "border_radius": "6px",
            "border_width": "0px",
            "border_color": "rgb(37, 99, 235)",
            "box_shadow": "none",
            "opacity": "1",
            "z_index": "auto"
          },
          {
            "id": "style:node_5",
            "node_id": "node_5",
            "display": "block",
            "position": "static",
            "color": "rgb(17, 24, 39)",
            "background_color": "rgba(0, 0, 0, 0)",
            "font_family": "Inter, system-ui, sans-serif",
            "font_size": "16px",
            "font_weight": "400",
            "line_height": "normal",
            "letter_spacing": "normal",
            "padding": "24px",
            "margin": "0px",
            "border_radius": "0px",
            "border_width": "0px",
            "border_color": "rgb(17, 24, 39)",
            "box_shadow": "none",
            "opacity": "1",
            "z_index": "auto"
          },
          {
            "id": "style:node_6",
            "node_id": "node_6",
            "display": "block",
            "position": "static",
            "color": "rgb(17, 24, 39)",
            "background_color": "rgba(0, 0, 0, 0)",
            "font_family": "Inter, system-ui, sans-serif",
            "font_size": "32px",
            "font_weight": "700",
            "line_height": "38px",
            "letter_spacing": "normal",
            "padding": "0px",
            "margin": "0px",
            "border_radius": "0px",
            "border_width": "0px",
            "border_color": "rgb(17, 24, 39)",
            "box_shadow": "none",
            "opacity": "1",
            "z_index": "auto"
          }
        ]
      },
      "layout": {
        "boxes": [
          {
            "id": "box:node_1",
            "node_id": "node_1",
            "x": 0,
            "y": 0,
            "width": 1440,
            "height": 900,
            "visible": true
          },
          {
            "id": "box:node_2",
            "node_id": "node_2",
            "x": 0,
            "y": 0,
            "width": 1440,
            "height": 64,
            "visible": true
          },
          {
            "id": "box:node_3",
            "node_id": "node_3",
            "x": 24,
            "y": 20,
            "width": 48,
            "height": 24,
            "visible": true
          },
          {
            "id": "box:node_4",
            "node_id": "node_4",
            "x": 88,
            "y": 14,
            "width": 84,
            "height": 36,
            "visible": true
          },
          {
            "id": "box:node_5",
            "node_id": "node_5",
            "x": 0,
            "y": 64,
            "width": 1440,
            "height": 160,
            "visible": true
          },
          {
            "id": "box:node_6",
            "node_id": "node_6",
            "x": 24,
            "y": 88,
            "width": 160,
            "height": 38,
            "visible": true
          }
        ]
      },
      "accessibility": {
        "nodes": [
          {
            "id": "aom:node_2",
            "node_id": "node_2",
            "role": "banner",
            "name_hash": "sha256:header",
            "disabled": false,
            "focused": false
          },
          {
            "id": "aom:node_3",
            "node_id": "node_3",
            "role": "link",
            "name_hash": "sha256:home",
            "disabled": false,
            "focused": false
          },
          {
            "id": "aom:node_4",
            "node_id": "node_4",
            "role": "button",
            "name_hash": "sha256:start",
            "disabled": false,
            "focused": false
          },
          {
            "id": "aom:node_5",
            "node_id": "node_5",
            "role": "main",
            "name_hash": "sha256:main",
            "disabled": false,
            "focused": false
          },
          {
            "id": "aom:node_6",
            "node_id": "node_6",
            "role": "heading",
            "name_hash": "sha256:h1",
            "disabled": false,
            "focused": false,
            "heading_level": 1
          }
        ]
      },
      "screenshots": []
    }
  ],
  "diagnostics": []
}
